{
	"$schema": "http://json-schema.org/draft-07/schema#",
	"title": "PRISM team config",
	"description": "Per-team config for token substitution and tech-stack-conditional content. Lives at .ai-skills/config.json in the consumer's repo. The onboarding flow (Atlas, Phase 2) writes this; agents read from it at chat time when behavior depends on tech stack. Derived tokens used at sync time but not stored as fields: ${PROJECT_LOWERCASE} (lowercase form of project, used for git-config namespaces), ${TICKET_PREFIX_LOWERCASE} (lowercase form of ticketPrefix). Add new derived tokens at the same seam in scripts/ai-skills/lib/tokens.ts (Phase 2).",
	"type": "object",
	"required": ["org", "project", "ticketPrefix", "ticketSystem"],
	"properties": {
		"org": {
			"type": "string",
			"description": "Display org name. Used in PR descriptions, changelog headers, etc.",
			"examples": ["TracTru"]
		},
		"project": {
			"type": "string",
			"description": "Project display name.",
			"examples": ["Thrive", "KTC", "KLC", "SPC"]
		},
		"ticketPrefix": {
			"type": "string",
			"description": "Ticket ID prefix used in branch names, commits, and PR titles.",
			"pattern": "^[A-Z][A-Z0-9]+$",
			"examples": ["THR", "KTC", "KLC", "SPC"]
		},
		"ticketSystem": {
			"type": "object",
			"description": "Ticket system configuration. `kind: \"linear\"` and `kind: \"github-issues\"` are supported; the object shape is the abstraction lever for future providers (e.g. Jira). The Linear-specific fields below apply only when `kind` is `linear`.",
			"required": ["kind"],
			"properties": {
				"kind": {
					"type": "string",
					"enum": ["linear", "github-issues"],
					"description": "Ticket system provider. `linear` carries workspace/teamKey; `github-issues` tracks work as GitHub issues with no Linear team."
				},
				"workspace": {
					"type": "string",
					"description": "Linear workspace slug (the part before .linear.app).",
					"examples": ["tractru"]
				},
				"projectId": {
					"type": "string",
					"description": "Linear project UUID, if scoped to a single project."
				},
				"teamKey": {
					"type": "string",
					"description": "Linear team key. Often matches ticketPrefix.",
					"examples": ["THR", "KTC"]
				}
			}
		},
		"github": {
			"type": "object",
			"description": "GitHub repo info for Eric (PR review), Sage (changelog), Reese (QA plans), Lilac (standup).",
			"properties": {
				"owner": { "type": "string" },
				"repo": { "type": "string" }
			}
		},
		"defaultBranch": {
			"type": "string",
			"description": "Default branch name. Most teams use `main`.",
			"default": "main"
		},
		"techStack": {
			"type": "array",
			"description": "Tech stack flags. Drives onboarding's per-codebase rule generation — for each language and framework listed, Atlas generates a corresponding rules file populated from patterns in the team's actual code (Phase 2). Validated against an enum so the set stays curated; add new values to the enum when a real team needs them.",
			"items": {
				"type": "string",
				"enum": [
					"typescript",
					"javascript",
					"react",
					"nextjs",
					"vue",
					"nuxt",
					"angular",
					"svelte",
					"node",
					"php",
					"python",
					"ruby",
					"go",
					"rust",
					"java",
					"kotlin",
					"swift",
					"wordpress",
					"gutenberg",
					"tailwind",
					"graphql",
					"apollo",
					"rest",
					"prisma"
				]
			},
			"uniqueItems": true,
			"examples": [["nextjs", "react", "typescript", "tailwind"]]
		},
		"hosts": {
			"type": "array",
			"description": "AI coding hosts this repo actually runs. Absent means all of them, so an existing install keeps its current behavior and needs no migration. This gates every host-specific delivery: the hook runtime and its registration (writes .claude/hooks/, merges the registration into .claude/settings.json, and appends the hook state-file globs to .gitignore only when `claude` is listed); the persona skill roster and agent definitions for each host; and the platform content copies of rules, architect docs, and templates. Removing a host from a repo that previously received its output makes the next `prism update` take that output back out.",
			"items": {
				"type": "string",
				"enum": ["claude", "codex", "cursor"]
			},
			"uniqueItems": true,
			"examples": [["claude"], ["codex", "cursor"]]
		},
		"commands": {
			"type": "object",
			"description": "Canonical verification commands for this team. Atlas populates this map during onboarding from the detected tech stack; skill prose and verification-commands.md reference these values as {{commands.*}} tokens so command strings live in one place. Each value is the full shell command to run from the repo root.",
			"properties": {
				"typecheck": {
					"type": "string",
					"description": "Command that runs the TypeScript type-checker (or equivalent for the team's language). Exit 0 means types pass.",
					"examples": ["pnpm run prism:check-types", "pnpm --filter=frontend run check-types"]
				},
				"test": {
					"type": "string",
					"description": "Command that runs the full test suite. Exit 0 means tests pass.",
					"examples": ["pnpm run prism:test", "pnpm run test"]
				},
				"lint": {
					"type": "string",
					"description": "Command that runs the linter (ESLint, crossref-lint, or equivalent). Exit 0 means lint passes.",
					"examples": ["pnpm run prism:crossref-lint", "pnpm run lint"]
				},
				"format": {
					"type": "string",
					"description": "Command that runs the formatter in check mode (Prettier --check, or equivalent). Empty string when the team has no standalone formatter step. Read by the push gate when hooks.pushVerification is on.",
					"examples": ["pnpm run format:check", "npx prettier --check ."]
				},
				"build": {
					"type": "string",
					"description": "Command that runs the full build. Exit 0 means the build passes.",
					"examples": ["pnpm run prism:build", "pnpm run build"]
				}
			},
			"additionalProperties": {
				"type": "string",
				"description": "Additional team-specific command slots (e.g. 'e2e', 'storybook'). Atlas may add these during onboarding."
			}
		},
		"rules": {
			"type": "object",
			"description": "Rule selection. `universal` is the always-included set (the universal rule set ships with PRISM). Language- and framework-specific rules are generated per-codebase during onboarding (Phase 2), not opted into via this field. `optIn` is reserved for future non-language opt-in rules.",
			"properties": {
				"universal": {
					"type": "string",
					"enum": ["all"],
					"default": "all"
				},
				"optIn": {
					"type": "array",
					"description": "Names of opt-in rule files (without .md extension).",
					"items": { "type": "string" }
				}
			}
		},
		"slackChannel": {
			"type": "string",
			"description": "Optional Slack channel for Lilac standup posting.",
			"examples": ["#tractru-dev"]
		},
		"productDomain": {
			"type": "string",
			"description": "One-sentence description of what the product does, collected during onboarding. Rendered into the `domain-context` anchor across the persona roster at output-regeneration time (scripts/ai-skills/generate-skills.ts) in place of the generic canonical default. Absent or empty means every persona body keeps its shipped default anchor content.",
			"examples": ["A multi-tenant SaaS platform for scheduling home service appointments."]
		},
		"documentation": {
			"type": "object",
			"description": "Documentation configuration. Populated by Atlas during onboarding (Phase 2). Eli reads these values to write guides shaped for the team's actual doc system — the format field in particular drives which patterns Eli uses. format is an open string, never a closed union: a new consumer adds their value here without a schema migration.",
			"properties": {
				"location": {
					"type": "string",
					"description": "Root path where the team's user-facing docs live, relative to the repo root.",
					"examples": ["docs/", "documentation/", "site/"]
				},
				"audience": {
					"type": "string",
					"description": "Primary audience for the docs. Use `developer-user` when the repo itself is a developer tool (the reader is also a builder). Other values are open — Atlas writes whatever the team's onboarding answer produces.",
					"examples": ["developer-user", "end-user", "mixed"]
				},
				"keepsDevDocs": {
					"type": "boolean",
					"description": "Whether the team maintains technical/dev docs separate from user-facing docs. When true, Eli's paired-doc workflow is active. When false, all docs are user-facing and the paired-doc flow is skipped."
				},
				"format": {
					"type": "string",
					"description": "Doc format the team uses. Open string — not a closed union. Atlas writes the value that matches the team's actual setup; Eli adapts its output to the declared format. Known values: `flat-markdown-guides` (PRISM), `nextra-blocks` (Thrive). New consumers add their own value here without a schema migration.",
					"examples": ["flat-markdown-guides", "nextra-blocks"]
				}
			}
		},
		"features": {
			"type": "object",
			"description": "Feature flags. Capabilities that are off by default; not surfaced during init or onboarding. Set manually after install.",
			"properties": {
				"mainSessionMayMerge": {
					"type": "boolean",
					"description": "When true, the main session may squash-merge a PR once the review loop came back clean and the PR carries no `review:has-minors` label. Absent or false by default — merge remains a human responsibility. Never mentioned in init or onboarding output."
				}
			}
		},
		"hooks": {
			"type": "object",
			"description": "Opt-in git gates run by the hook runtime on the hosts that receive it. Absent means every gate is off. Not surfaced during init or onboarding — set by hand, like features.",
			"properties": {
				"commitCleanupPass": {
					"type": "boolean",
					"description": "Hold the first `git commit` on each HEAD until .prism/references/cleanup-pass.md has been read this session; the retry goes through."
				},
				"pushVerification": {
					"type": "boolean",
					"description": "Run commands.lint and commands.format before every `git push`; a non-zero exit denies the push with the output tail. An unset command is skipped; a timeout allows the push and says so."
				},
				"pushVerificationTimeoutMs": {
					"type": "integer",
					"minimum": 1000,
					"default": 120000,
					"description": "Per-command budget for pushVerification. Keep it below the host's own hook timeout (Claude Code: 600 s by default) so the script, not the host, decides the outcome."
				}
			}
		},
		"retroEvidence": {
			"type": "object",
			"description": "Per-team execution-record sources for Iris's retro charter (the retro skill). Populated by Atlas's retro-evidence onboarding question set. A source this block marks absent renders in the retro's charter-coverage table as 'not configured for this team', distinct from a configured-but-unreachable-this-run source — so the coverage table degrades honestly on teams without CI or without a GitHub-hosted PR platform.",
			"properties": {
				"ci": {
					"type": "object",
					"description": "Whether this team runs CI, and which system. Absent or `present: false` means charter item 6 (test-passing / CI record) always renders as not-configured.",
					"properties": {
						"present": { "type": "boolean" },
						"system": {
							"type": "string",
							"description": "CI system name. Open string — Atlas writes whatever the team names.",
							"examples": ["github-actions", "circleci", "gitlab-ci", "none"]
						}
					}
				},
				"prPlatform": {
					"type": "string",
					"description": "Platform hosting PRs/reviews. Drives how the retro skill fetches PR review threads for charter items 4/5. Open string — not limited to GitHub.",
					"examples": ["github", "gitlab", "bitbucket"]
				},
				"testCommand": {
					"type": "string",
					"description": "The team's test command, for reference in the retro's CI-conclusion reads. Mirrors commands.test — kept as a separate field so retroEvidence stays self-contained even if commands.* changes shape later.",
					"examples": ["pnpm run prism:test"]
				},
				"dodGates": {
					"type": "array",
					"description": "The gates that define 'done' for this team (types, lint, tests, build, coverage, etc.) — informs which charter items the retro skill can expect evidence for.",
					"items": { "type": "string" },
					"examples": [["types", "crossref-lint", "tests", "build"]]
				}
			}
		},
		"modelTiers": {
			"type": "object",
			"description": "Optional model selection. Only `overrides` is read today, by the review loop, which honors an `eric` entry when present.",
			"properties": {
				"overrides": {
					"type": "object",
					"description": "Optional per-persona model pins keyed by lowercase persona name. The seam for cross-model review: pin `eric` to a different model family than the workers. A value is a concrete model name for this runtime, such as `opus`, `sonnet`, or `gpt-5`.",
					"additionalProperties": { "type": "string" }
				}
			}
		}
	}
}
